,title,description,tags,release_date,ISBN_number,publisher,author_name,author_birth_year,pages,related_courses,format,rating,edition
317,The Art of Coding: A Comprehensive Guide,"This book covers a wide range of programming languages and concepts, including Python, Java, and web development.","['coding', 'programming', 'Python', 'Java', 'web development']",2022-08-15,978-1-2345-6789-0,TechPub Inc.,Xander McTechie,1985.0,,,,,
318,The Art of Proggramming,A comprehensive guide to mastering programming languages and algorithms.,"['programming', 'algorithms', 'education']",2020-05-15,978-1-56619-909-4,TechEdu Publications,Xavieer Smiith,1975.0,,,,,
319,Netwrok Security Fundametnals,An in-depth exploration of network security principles and best practices.,"['networking', 'security', 'cybersecurity']",2018-10-20,978-1-59327-554-9,SecurePub,Xavieer Smiith,1975.0,,,,,
320,Data Science Essentials,"A practical handbook for aspiring data scientists, covering key concepts and tools.","['data science', 'analytics', 'machine learning']",2017-04-12,978-1-4919-1889-2,DataWorks Press,Xavieer Smiith,1975.0,,,,,
321,Harry Potter and the Chamber of Secrets,The second year at Hogwarts brings more perilous adventures for Harry Potter.,"['wizardry', 'magic', 'adventure']",1998-07-02,9780439064866,Scholastic Inc.,Xavieer Smiith,1975.0,,,,,
322,Network Security Fundamentals,An essential resource for understanding the principles of network security and implementing best practices.,"['network', 'security', 'fundamentals', 'best practices']",2018-11-25,978-6-7890-1234-5,SecureNet Books,Xavieer Smiith,1975.0,,,,,
323,The Art of Computer Science,A comprehensive guide to computer science principles and applications.,"['computer science', 'programming', 'algorithms']",2020-08-15,978-1-234567-89-0,,Xavieer Smiith,1975.0,,,hardcover,,
324,Networking Essentials: A Comprehensive Approach,"A comprehensive guide to networking essentials, suitable for both beginners and advanced learners in IT education.","['networking', 'data transmission', 'IT infrastructure']",2018-05-20,978-1-25-683902-4,Connectivity Press,Xavieer Smiith,1975.0,,,,,
325,The Art of Computer Programming,"This book is a comprehensive guide to the art of computer programming, covering algorithms and data structures.","['algorithms', 'data structures', 'computer programming']",1973-01-10,0-201-03801-3,Addison-Wesley,Lavina Smith,1985.0,,,,,
326,Introduction to Information Retrieval,"A thorough introduction to the field of information retrieval, covering indexing, searching, and evaluation.","['information retrieval', 'indexing', 'searching']",2008-07-01,978-0521865715,Cambridge University Press,Lavina Smith,1985.0,,,,,
327,Computer Networking: A Top-Down Approach,"An in-depth exploration of computer networking, emphasizing the Internet's application layer.","['computer networking', 'Internet', 'application layer']",2012-06-05,978-0133072624,Pearson,Lavina Smith,1985.0,,,,,
328,Data Analytics Essentials,Exploring the fundamentals of data analytics and its applications.,"['data analytics', 'big data', 'data visualization']",2019-03-12,978-6-7890-1234-5,DataInsights,Lavina Smith,1985.0,280.0,,,,
329,Network Security Fundamentals,An essential resource for understanding the principles of network security and implementing best practices.,"['network', 'security', 'fundamentals', 'best practices']",2018-11-25,978-6-7890-1234-5,SecureNet Books,Lavina Smith,1985.0,,,,,
330,Network Infrastructure Planning and Deployment,A practical handbook for designing and implementing network infrastructure in educational institutions.,"['network', 'infrastructure', 'planning', 'deployment', 'educational institutions']",2019-11-10,978-1-119-59283-7,Netw0rkBooks,Lavina Smith,1985.0,,,,,
331,Data Science Fundamentals,A beginner's guide to data analysis and machine learning techniques in Python.,"['data science', 'Python', 'machine learning']",2018-11-30,978-1-4919-6107-6,DataWorks Publishing,Lavina Smith,1985.0,,,,,
332,The Art of Proggramming,A comprehensive guide to mastering programming languages and algorithms.,"['programming', 'algorithms', 'education']",2012-05-15,978-0-1234567-8-9,TechEdu Publications,Xavier Smith,1975.0,,,,,
333,Data Structures Demystified,Exploring the fundamental concepts of data structures in a simplified manner.,"['data structures', 'algorithms', 'learning']",2008-11-30,978-0-9876543-2-1,InfoTech Books,Xavier Smith,1975.0,,,,,
334,Cybersecurity Essentials,An introductory book on cybersecurity for IT professionals and students.,"['cybersecurity', 'IT security', 'networks']",2015-09-20,978-0-2468101-1-2,SecurePress,Xavier Smith,1975.0,,,,,
335,Data Science Fundementals,A deep dive into the core concepts of data science and analytics.,"['data', 'science', 'analytics']",2019-11-10,978-3-2109-8765-4,,Xavier Smith,1975.0,420.0,,,,
336,Harry Potter and the Chamber of Secrets,The second year at Hogwarts brings more perilous adventures for Harry Potter.,"['wizardry', 'magic', 'adventure']",1998-07-02,9780439064866,Scholastic Inc.,Xavier Smith,1975.0,,,,,
337,The Art of Progamming,A comprehensive guide to mastering programming languages and algorithms.,"['progrmming', 'algorithms', 'coding']",2020-08-15,978-3-16-148410-0,TechEdu Publications,Lavrense Page,1978.0,,,,,
338,Netwroking Essentials,An in-depth exploration of networking fundamentals and protocols.,"['networking', 'protocols', 'data transmission']",2015-06-20,978-1-25-846372-2,InfoTech Press,Lavrense Page,1978.0,,,,,
339,Cybersecurity Fundametnals,A beginner's guide to understanding cybersecurity principles and best practices.,"['cybersecurity', 'information security', 'risk management']",2018-11-10,978-0-74-921637-7,SecureEd Publishing,Lavrense Page,1978.0,,,,,
340,Introducton to Python Programming,"A comprehensve guide to learnng Pythn programmnig for begnners and experts alke. Covering data structures, algorthms, and applcatons.","['Python', 'Programming', 'Data Structures', 'Algorithms']",2020-05-15,978-3-16-148410-0,TechBooks Inc.,Lavrense Page,1978.0,,,,,
341,The Art of Computer Science,"A comphrensive guide to computer science education, covering topics such as algorithms, data structures and programming languages.","['computer science', 'algorithms', 'programming languages']",2015-07-21,978-0-13-449416-6,Pearson Education,Lavrense Page,1978.0,,,,,
342,The Art of Computer Science,A comprehensive guide to computer science principles and practices.,"['computer science', 'programming', 'algorithms']",2017-05-15,978-1-234567-89-0,TechBooks Inc.,Lavrense Page,1978.0,,,,,
343,The Art of Progrmming,A comprehensive guide to lerning programming languages and software development practices.,"['progrmming', 'software development', 'lerning']",2020-05-15,978-3-16-148410-0,,Xaiver Smith,1980.0,,,ebook,,
344,Netwroks and Security: A Hands-On Approach,Exploring the fundementals of computer netwroks and security measures for IT professionals.,"['netwroks', 'security', 'IT professionals']",2018-10-20,978-1-23-456789-0,,Xaiver Smith,1980.0,,,hardcover,,
345,Data Science Essentials,An introduction to data science principles and its applications in educational settings.,"['data science', 'education', 'applications']",2019-04-30,978-0-08-102204-4,,Xaiver Smith,1980.0,,,paperback,,
346,Netwroking Essentials,An in-depth look at networking essentials for IT professionals.,"['networking', 'IT infrastructure', 'data transmission']",2018-10-22,978-1-25-607510-4,,Xaiver Smith,1980.0,,,,,
347,The Art of Computer Science,A comprehensive guide to computer science fundamentals and programming principles.,"['computer science', 'programming', 'algorithms']",2022-05-15,978-1-2345-6789-0,TechPub Inc.,Xaiver Smith,1980.0,,,,,
348,The Art of Coding: A Comprehensive Guide,This book covers a wide range of programming languages and best practices for IT students.,"['programming', 'languages', 'best practices']",2021-06-15,978-3-16-148410-0,TechBooks Inc.,Dr. Alica Smith,1978.0,,,,,
349,Cybersecurity Fundamentals,An introductory book on cybersecurity for beginners in the field of IT education.,"['cybersecurity', 'fundamentals', 'beginners']",2019-02-28,978-1-25-680932-6,SecurePress,Dr. Alica Smith,1978.0,,,,,
350,Data Science Essentials,A practical guide to understanding and applying data science concepts in an educational setting.,"['data science', 'practical guide', 'educational']",2020-11-12,978-2-45-791038-4,DataWorks Ltd.,Dr. Alica Smith,1978.0,,,,,
351,Cybersecurity Essentials,Essential concepts of cybersecurity for IT students and professionals.,"['cybersecurity', 'essentials', 'education']",2017-11-30,978-1-58713-345-1,,Dr. Alica Smith,1978.0,,,,,
352,Data Structures Demystified,"A practical approach to understanding and implementing data structures in programming languages, with real-world examples and exercises.","['data structures', 'programming', 'algorithms', 'implementation']",2019-11-10,978-6-543210-98-7,DataWise Books,Dr. Alica Smith,1978.0,,,,,
353,Databas3 Fund4mentals,A practical approach to understanding database concepts and management for students and aspiring database administrators.,"['database', 'management', 'students', 'administrators']",2020-11-10,978-0-76-213984-8,DataMinds Press,Dr. Alica Smith,1978.0,,,,,
354,Network Security Fundamentals,An essential resource for understanding the principles of network security and implementing best practices.,"['network', 'security', 'fundamentals', 'best practices']",2018-11-25,978-6-7890-1234-5,SecureNet Books,Dr. Alica Smith,1978.0,,,,,
355,Data Science in Education: Bridging Theory and Practice,"Examines the application of data science techniques in educational settings, offering insights for IT educators.","['data science', 'education', 'IT educators']",2019-04-12,978-0-5555-4321-0,Academic Publishing Co.,Dr. Alica Smith,1978.0,,,,,
356,Cleam Code,"A book on writing maintainable code in Java, C++, and other programming languages.","['clean code', 'software development', 'programming practices']",2008-08-11,978-0-13-235088-4,,Dr. Alica Smith,1978.0,,,,,
357,Data Science Foundations: From Theory to Practice,"An introductory text on data science, focusing on statistical analysis, machine learning, and big data technologies. Suitable for students and professionals alike.","['data science', 'statistical analysis', 'machine learning', 'big data']",2018-07-10,978-0-13-518279-2,DataWorks Co.,Dr. Alica Smith,1978.0,,,,,
358,The Art of Computer Science,A comprehensive guide to computer science fundamentals and programming principles.,"['computer science', 'programming', 'algorithms']",2022-05-15,978-1-2345-6789-0,TechPub Inc.,Xavieer Smiith,1980.0,,,,,
359,Cybersecurity Essentials,An introduction to cybersecurity concepts and best practices for IT professionals.,"['cybersecurity', 'network security', 'information security']",2018-10-20,978-0-5432-1897-6,SecurePress,Xavieer Smiith,1980.0,,,,,
360,Data Analytics: From Theory to Practice,Exploring the application of data analytics in educational settings and decision-making processes.,"['data analytics', 'educational technology', 'data-driven decision making']",2020-03-12,978-6-7890-1234-5,Insightful Books Co.,Xavieer Smiith,1980.0,,,,,
361,The Art of Proggramming,A compreehensive guide to software development and algorithm design.,"['programming', 'algorithms', 'software development']",2022-05-15,978-3-16-148410-0,TechEdu Press,Xavieer Smiith,1980.0,,,,,
362,Netwrok Security Fundamentalls,Exploring the core principles of network security and cyber defense.,"['network security', 'cyber defense', 'information security']",2018-11-30,978-1-25-680011-2,CyberSafe Publications,Xavieer Smiith,1980.0,,,,,
363,Data Science Essentials,An introduction to data science concepts and techniques for educational purposes.,"['data science', 'educational technology', 'big data']",2019-08-20,978-0-07-183567-4,DataMinds Inc.,Xavieer Smiith,1980.0,,,,,
364,Cybersecurity Essentials for Teachers,This book provides an overview of cybersecurity principles and best practices tailored for educators and IT professionals.,"['cybersecurity', 'education', 'network security']",2017-04-10,978-6-7890-1234-5,SecureIT Books,Xavieer Smiith,1980.0,,,,,
365,The Art of Coding: A Comprehensiv Guide,"This book explores the fundementals of coding and software developement, covering a wide range of programming languages and best practices.","['coding', 'software development', 'programming languages']",2015-08-20,978-1-2345-6789-0,,Johann Smoth,1967.0,,,,,
366,Cybersecurity Essentials for Beginners,"An introductry guide to cybersecurity, focusing on essential concepts and techniques for beginners in the field.","['cybersecurity', 'network security', 'information security']",2020-03-15,978-0-5432-1987-6,,Johann Smoth,1967.0,,,,,
367,Data Science Foundations: From Theory to Practice,This book provides a comprehensive overview of data science principles and their practical applications in real-world scenarios.,"['data science', 'big data', 'machine learning']",2018-11-10,978-6-7890-1234-5,,Johann Smoth,1967.0,,,,,
368,The Art of Computer Science,A comprehensive guide to computer science principles and applications.,"['computer science', 'programming', 'algorithms']",2020-08-15,978-1-234567-89-0,,Johann Smoth,1967.0,,,hardcover,,
369,Cybersecurity Fundamentals,An introductory book on cybersecurity for beginners.,"['cybersecurity', 'network security', 'data protection']",2018-05-20,978-1-119-50458-2,SecurePress,Johann Smoth,1967.0,250.0,,,,
370,The Art of Computer Sciecne,"A comphrensive guide to computer sciecne education, covering topics like algorithims, data structures and programming languages.","['computer science', 'algorithms', 'data structures', 'programming languages']",2022-01-15,978-3-16-148410-0,,Xander McTech,1978.0,,,,,
371,Netwroking Fundametnals,"An in-depth look at networking fundamentals, including TCP/IP, routing, switching, and network security.","['networking', 'TCP/IP', 'routing', 'switching', 'network security']",2019-08-20,978-1-25-416789-4,,Xander McTech,1978.0,,,,,
372,Cybersecurity Essentials,"Essential concepts and best practices in cybersecurity, covering threat intelligence, cryptography, and risk management.","['cybersecurity', 'threat intelligence', 'cryptography', 'risk management']",2017-05-10,978-0-13-446581-5,,Xander McTech,1978.0,,,,,
373,The Art of Proggramming,A comprehensive guide to software development and coding practices.,"['programming', 'software development', 'coding']",2016-08-15,978-0-1234567-8-9,TechPub Inc.,Xander McTech,1978.0,,,,,
374,Cybersecurity Essentials,An essential primer on cybersecurity principles and best practices for students and professionals in the field.,"['cybersecurity', 'network security', 'education']",2019-10-20,978-0-98765-432-1,,Xander McTech,1978.0,,,ebook,,
375,The Art of Coding: A Comprehensive Guide,"Thi's book explores the fundementals of coding and programming, with a focus on practical application in educational settings.","['coding', 'programming', 'education']",2020-06-15,978-1-2345-6789-0,TechEd Press,Dr. Alysia Smith,1978.0,,,,,
376,Data Science for Educators,"A guide to integrating data science into the curriculum, covering statistical analysis and machine learning concepts.","['data science', 'education', 'statistics']",2018-11-20,978-0-9876-5432-1,Academic Publishing House,Dr. Alysia Smith,1978.0,,,,,
377,Cybersecurity Essentials for Teachers,This book provides an overview of cybersecurity principles and best practices tailored for educators and IT professionals.,"['cybersecurity', 'education', 'network security']",2017-04-10,978-6-7890-1234-5,SecureIT Books,Dr. Alysia Smith,1978.0,,,,,
378,The Art of Computer Science,A compreehensive guide to computer science education.,"['computer', 'science', 'education']",2020-05-15,978-3-16-148410-0,TechPub Inc.,Dr. Alysia Smith,1978.0,,,,,
379,C0ding for Beginners,"A comprehensive guide to learning programming languages from scratch, with a focus on practical applications in Information Technolgy.","['programming', 'beginner', 'IT', 'education']",2015-10-15,978-1-56619-909-4,TechBooks Inc.,Dr. Alice Margaret,1978.0,,,,,
380,Cybersecurity Essentials,An introductory book covering the fundamental concepts of cybersecurity and its importance in modern IT education.,"['cybersecurity', 'essentials', 'IT', 'education']",2018-04-25,978-1-119-50477-3,SecurePress,Dr. Alice Margaret,1978.0,,,,,
381,Data Science Fundamentals,Exploring the core principles and techniques used in data science within the context of Information Technology education.,"['data science', 'fundamentals', 'IT', 'education']",2020-09-12,978-0-13-468710-6,DataWorks Publishing,Dr. Alice Margaret,1978.0,,,,,
382,The Art of Computer Science,A comprehensive guide to computer science principles and practices.,"['computer science', 'programming', 'algorithms']",2020-08-15,978-3-16-148410-0,,Dr. Alice Margaret,1978.0,,,hardcover,,
383,Introduction to Cybersecurity,A comprehensive guide to cybersecurity principles and practices.,"['cybersecurity', 'network security', 'information protection']",2020-05-15,978-1-2345-6789-0,,Dr. Alice Margaret,1978.0,,,,,
384,Computer Networking: A Top-Down Approach,"Explores the principles, technologies, and protocols used in networking.","['networking', 'protocols', 'communication']",2012-08-24,9780133072624,,Dr. Alice Margaret,1978.0,,,,,6th
385,The Art of Progamming,A comprehensive guide to modern programming practices and methodologies.,"['progrmming', 'methodolgies', 'software development']",2022-05-15,978-3-16-148410-0,TechBooks Inc.,Dr. Alice Margaret,1978.0,,,,,
386,Cybersecurity Essentials for Students,"A beginner's guide to cybersecurity, tailored specifically for students pursuing IT education.","['cybersecurity', 'students', 'beginner', 'IT education']",2018-11-30,978-0-9876-5432-1,,Dr. Alice Margaret,1978.0,,,ebook,,
387,The Art of Progamming,A comprehensive guide to programming concepts and best practices for aspiring IT professionals.,"['programming', 'best practices', 'IT education']",2020-08-15,978-1-2345-6789-0,TechEdu Publications,Lysa Grange,1975.0,,,,,
388,Netwroking Essentials,An in-depth exploration of networking fundamentals and technologies essential for IT students.,"['networking', 'fundamentals', 'technologies', 'IT education']",2018-05-20,978-0-5432-1987-6,InfoTech Books,Lysa Grange,1975.0,,,,,
389,Cybersecurity Fundametnals,A beginner's guide to cybersecurity principles and practices for students pursuing IT careers.,"['cybersecurity', ""beginner's guide"", 'principles', 'IT education']",2019-11-10,978-6-7890-1234-5,SecureEd Press,Lysa Grange,1975.0,,,,,
390,Introduktion to Informatics,A compreensive guide to the fundamentels of informatics and computer science.,"['informatics', 'computer science', 'education']",2014-06-15,978-0-13-212271-9,,Lysa Grange,1975.0,,,,,
391,Network Infrastructure Planning and Deployment,A practical handbook for designing and implementing network infrastructure in educational institutions.,"['network', 'infrastructure', 'planning', 'deployment', 'educational institutions']",2019-11-10,978-1-119-59283-7,Netw0rkBooks,Lysa Grange,1975.0,,,,,
392,The Art of Proggramming,A comprehensive guide to mastering programming languages and algorithms.,"['programming', 'algorithms', 'education']",2020-05-15,978-1-56619-909-4,TechEdu Publications,Lysa Grange,1975.0,,,,,
393,The Art of Coding: A Comprehensive Guide,"This book explores the fundamental principles of coding and programming, with a focus on practical applications in IT education.","['coding', 'programming', 'IT education']",2020-06-15,978-1-2345-6789-0,,Dr. Alysia Smiht,1975.0,,,hardcover,,
394,Cybersecurity Essentials for Students,"A beginner's guide to cybersecurity, tailored specifically for students pursuing IT education.","['cybersecurity', 'students', 'beginner', 'IT education']",2018-11-30,978-0-9876-5432-1,,Dr. Alysia Smiht,1975.0,,,ebook,,
395,Data Structures and Algorithms Simplified,"An in-depth exploration of data structures and algorithms essential for IT education, with practical examples and exercises.","['data structures', 'algorithms', 'IT education']",2015-03-20,978-6-7890-1234-5,,Dr. Alysia Smiht,1975.0,,,paperback,,
396,The Art of Computer Science,"A comphrensive guide to computer science education, covering topics such as algorithms, data structures and programming languages.","['computer science', 'algorithms', 'programming languages']",2015-07-21,978-0-13-449416-6,Pearson Education,Dr. Alysia Smiht,1975.0,,,,,
397,The Fundamentels of Network Security,A comprehensive guide to network security principles and best practices.,"['network', 'security', 'cybersecurity']",2020-06-15,978-1-2345-6789-0,TechPress,Dr. Alysia Jonson,1978.0,320.0,,,,
398,Data Science for Beginners,An introductory book on data science concepts and applications in IT education.,"['data', 'science', 'analytics']",2019-03-10,978-0-5432-1987-3,InfoBooks,Dr. Alysia Jonson,1978.0,280.0,,,,
399,Cloud Computing Essentials,Exploring the core concepts and technologies of cloud computing for educational purposes.,"['cloud', 'computing', 'virtualization']",2018-11-20,978-6-7890-1234-5,CloudPub,Dr. Alysia Jonson,1978.0,350.0,,,,
400,The Art of Coding,A comprehensive guide to programming and software development.,"['programming', 'software development', 'education']",2020-08-15,978-1-2345-6789-0,TechBooks Inc.,Dr. Alysia Jonson,1978.0,,,,,
401,The Art of Computer Science,A comprehensive guide to computer science principles and practices.,"['computer science', 'programming', 'algorithms']",2020-08-15,978-3-16-148410-0,,Dr. Alysia Jonson,1978.0,,,hardcover,,
402,The Art of Computer Science,A comprehensive guide to computer science principles and applications.,"['computer science', 'programming', 'algorithms']",2020-08-15,978-1-234567-89-0,,Dr. Alysia Jonson,1978.0,,,hardcover,,
403,Cybersecurity Essentials,"An introduction to cybersecurity principles and practices, including network security, cryptography, and risk management.","['cybersecurity', 'network security', 'cryptography']",2020-11-30,978-0-5432-1987-6,SecureBooks Co.,Dr. Alysia Jonson,1978.0,,,,,
404,C0ding for Beginners,A comprehensive guide to learning programming languages such as Pyth0n and Javascr1pt. It covers basic concepts and advanced techniques.,"['programming', 'Python', 'JavaScript']",2022-05-15,978-1-2345-6789-0,TechPub Inc.,Dr. Alice Marvel,,,,,,
405,Cybersecurity Essentials,"An introduction to cybersecurity principles and practices, including network security, cryptography, and risk management.","['cybersecurity', 'network security', 'cryptography']",2020-11-30,978-0-5432-1987-6,SecureBooks Co.,Dr. Alice Marvel,,,,,,
406,Data Science Fundamentals,"Exploring the foundations of data science, from statistical analysis to machine learning algorithms and big data processing.","['data science', 'machine learning', 'big data']",2018-07-20,978-6-7890-1234-5,DataWorks Ltd.,Dr. Alice Marvel,,,,,,
407,Harry Potter and the Chamber of Secrets,The second year at Hogwarts brings more perilous adventures for Harry Potter.,"['wizardry', 'magic', 'adventure']",1998-07-02,9780439064866,Scholastic Inc.,Dr. Alice Marvel,,,,,,
408,Cybersecurity Fundamentals,An introductory book on cybersecurity for beginners.,"['cybersecurity', 'network security', 'data protection']",2018-05-20,978-1-119-50458-2,SecurePress,Dr. Alice Marvel,,250.0,,,,
409,The Art of Coding: A Comprehensive Guide,"This book covers the fundementals of programing and software development, including object-oriented design principles and data structures.","['programing', 'software development', 'object-oreinted design', 'data strutcures']",2012-06-15,978-0-13-449416-6,TechPub Inc.,Dr. Alice Marvel,,,,,,
410,The Future of Coding: A Comprehensive Guide,This book explores the evolving landscape of programming languages and their impact on IT education.,"['coding', 'programming languages', 'IT education']",2022-05-15,978-1-1234-5678-9,TechPublishing Inc.,Dr. Alysia Johnson,1978.0,,,,,
411,Cybersecurity Fundamentals for Educators,A practical resource for educators to integrate cybersecurity concepts into IT curriculum.,"['cybersecurity', 'education', 'IT curriculum']",2020-10-20,978-1-9876-5432-1,EduTech Press,Dr. Alysia Johnson,1978.0,,,,,
412,Data Science in Education: Bridging Theory and Practice,"Examines the application of data science techniques in educational settings, offering insights for IT educators.","['data science', 'education', 'IT educators']",2019-04-12,978-0-5555-4321-0,Academic Publishing Co.,Dr. Alysia Johnson,1978.0,,,,,
413,Netw0rk Security Fundament@ls,"An essential book covering the basics of network security, including firewalls, encryption, and intrusion detection systems.","['network security', 'firewalls', 'encryption', 'intrusion detection']",2018-10-20,978-0-5432-1897-6,CyberSafe Publishing,Dr. Alysia Johnson,1978.0,,,,,
414,Network Security Fundamentals,An essential resource for understanding the principles of network security and implementing best practices.,"['network', 'security', 'fundamentals', 'best practices']",2018-11-25,978-6-7890-1234-5,SecureNet Books,Dr. Alysia Johnson,1978.0,,,,,
415,The Art of Coding: A Comprehensiv Guide,Thi book coveres a wide range of programming languages and their application in educational settings.,"['programming', 'education', 'coding']",2021-05-15,978-3-16-148410-0,TechEd Press,Jennifir Smoth,1980.0,,,,,
416,Cybersecurity Fundamentls for Students,"A practical approach to teaching cybersecurity concepts to IT students, with hands-on exercises and case studies.","['cybersecurity', 'IT education', 'network security']",2019-10-20,978-1-25-648301-2,SecureEd Publishing,Jennifir Smoth,1980.0,,,,,
