,title,description,tags,release_date,ISBN_number,publisher,author_name,author_birth_year,pages,related_courses,format,rating,edition
212,Inf0rmation T3chnology in Education: A Comprehensive Guide,"Thiis book provides an overview of the latest trends and technologies in IT education, including programming languages, networking, and cybersecurity.","['education', 'technology', 'programming', 'cybersecurity']",2022-05-15,978-1-234567-89-0,TechEd Press,Dr. Alice Mariotti,1975.0,,,,,
213,Data Analytics for Educators,"This book explores the use of data analytics in educational settings, covering topics such as student performance analysis and predictive modeling.","['data analytics', 'education', 'statistics', 'predictive modeling']",2019-11-30,978-0-987654-32-1,EduTech Publishing,Dr. Alice Mariotti,1975.0,,,,,
214,Cybersecurity Fundamentals for Teachers,A practical guide for educators to understand the basics of cybersecurity and implement best practices in the classroom environment.,"['cybersecurity', 'teachers', 'network security', 'best practices']",2017-08-20,978-6-543210-98-7,SecureEd Press,Dr. Alice Mariotti,1975.0,,,,,
215,Cleam Code,"A book on writing maintainable code in Java, C++, and other programming languages.","['clean code', 'software development', 'programming practices']",2008-08-11,978-0-13-235088-4,,Dr. Alice Mariotti,1975.0,,,,,
216,The Art of Proggramming,A comprehensive guide to mastering programming languages and algorithms.,"['programming', 'algorithms', 'education']",2020-05-15,978-1-56619-909-4,TechEdu Publications,Dr. Alice Mariotti,1975.0,,,,,
217,The Cod1ng Rev0lut10n,A comprehensive guide to modern programming languages and techniques for beginners.,"['programming', 'languages', 'beginners']",2022-07-15,978-3-16-148410-0,TechEdu Publishing,Xavier Smith,,,,,,
218,Netw0rk Secur1ty Essentials,An in-depth exploration of network security principles and best practices for IT professionals.,"['network', 'security', 'IT', 'professionals']",2019-05-20,978-1-25-846372-6,CyberGuard Books,Xavier Smith,,,,,,
219,Databas3 Fund4mentals,A practical approach to understanding database concepts and management for students and aspiring database administrators.,"['database', 'management', 'students', 'administrators']",2020-11-10,978-0-76-213984-8,DataMinds Press,Xavier Smith,,,,,,
220,Data Science in Education: Bridging Theory and Practice,"Examines the application of data science techniques in educational settings, offering insights for IT educators.","['data science', 'education', 'IT educators']",2019-04-12,978-0-5555-4321-0,Academic Publishing Co.,Xavier Smith,,,,,,
221,The Art of Coding: A Comprehensiv Guide,"This book covers the fundementals of programming and software development, with a focus on practical applications for Information Technology students.","['programming', 'software development', 'IT education']",2023-06-15,978-1-78439-989-5,TechPublishing Inc.,Dr. Alisha Jonson,1978.0,,,,,
222,Cybersecurity Essentials: A Student's Handbook,"A comprehensive guide to cybersecurity essentials for students pursuing careers in IT, covering topics such as network security, cryptography, and risk management.","['cybersecurity', 'network security', 'cryptography', 'risk management']",2020-11-30,978-0-13456-789-2,SecurePress,Dr. Alisha Jonson,1978.0,,,,,
223,Data Science Foundations: From Theory to Practice,"This book provides a solid foundation in data science concepts and techniques, tailored for IT education programs, with real-world examples and case studies.","['data science', 'data analysis', 'machine learning', 'IT education']",2019-04-25,978-3-59876-543-2,DataWorks Publishing,Dr. Alisha Jonson,1978.0,,,,,
224,Networking Essentials for Students,"A practical approach to understanding networking concepts and protocols, with hands-on exercises for students.","['networking', 'protocols', 'hands-on']",2018-05-20,978-1-23-456789-0,EduTech Publications,Dr. Alisha Jonson,1978.0,,,,,
225,The Art of Progrmming,A comprehensive guide to lerning programming languages and software development practices.,"['progrmming', 'software development', 'lerning']",2020-05-15,978-3-16-148410-0,,Dr. Alisha Jonson,1978.0,,,ebook,,
226,Introduction to Cybersecurity,A comprehensive guide to cybersecurity principles and practices.,"['cybersecurity', 'network security', 'information protection']",2020-05-15,978-1-2345-6789-0,,Lynxie Smitherz,1985.0,,,,,
227,Data Structures & Algorithms in Python,An in-depth exploration of data structures and algorithms using the Python programming language.,"['python', 'algorithms', 'data structures']",2018-10-22,978-0-5432-1987-6,,Lynxie Smitherz,1985.0,,,,,
228,Cloud Computing Essentials,A practical overview of cloud computing technologies and their applications in modern IT environments.,"['cloud computing', 'virtualization', 'distributed systems']",2019-07-11,978-3-2109-8765-4,,Lynxie Smitherz,1985.0,,,,,
229,The Art of Computer Programming,A comprehensive guide to algorithms and data structures.,"['algorithms', 'data structures', 'computer science']",1973-01-10,0-201-03801-3,,Lindsey Stirling,1986.0,,,,,
230,Cleam Code,"A book on writing maintainable code in Java, C++, and other programming languages.","['clean code', 'software development', 'programming practices']",2008-08-11,978-0-13-235088-4,,Lindsey Stirling,1986.0,,,,,
231,Introducton to Information Technology,An introductory textbook covering the basics of IT infrastructure and systems.,"['IT basics', 'technology introduction', 'information systems']",2015-03-20,978-1-305-25314-7,,Lindsey Stirling,1986.0,,,,,
232,Networking Essentials: A Comprehensive Approach,"A comprehensive guide to networking essentials, suitable for both beginners and advanced learners in IT education.","['networking', 'data transmission', 'IT infrastructure']",2018-05-20,978-1-25-683902-4,Connectivity Press,Lindsey Stirling,1986.0,,,,,
233,The Fundamentls of Data Science,A comprehensve guide to data analysis and machine learning,"['data', 'science', 'machine', 'learning']",2020-08-15,978-3-16-148410-0,,Xavier LeClerc,1978.0,,,,,
234,Cybersecurity Essentials,An introducton to the core concepts of cybersecurity,"['cybersecurity', 'essentials', 'concepts']",2019-05-20,978-1-23-456789-0,,Xavier LeClerc,1978.0,,,,,
235,Cloud Computing for Beginners,A beginner's guide to cloud computng and its applications,"['cloud', 'computing', 'beginners', 'applications']",2018-11-10,978-6-78-912345-6,,Xavier LeClerc,1978.0,,,,,
236,Cleam Code,"A book on writing maintainable code in Java, C++, and other programming languages.","['clean code', 'software development', 'programming practices']",2008-08-11,978-0-13-235088-4,,Xavier LeClerc,1978.0,,,,,
237,The Art of Proggramming,"This book covers the fundementals of proggramming and software development, with a focus on practical applications for Information Techonology students.","['proggramming', 'software development', 'IT education']",2020-07-15,978-3-16-148410-0,TechPub,Xander Smith,1985.0,320.0,,,,
238,Netwroking Essentials,"A comprehensive guide to netwroking concepts and practices, tailored for students pursuing careers in IT and computer science.","['netwroking', 'network security', 'IT infrastructure']",2018-04-25,978-1-23-456789-0,InfoBooks,Xander Smith,1985.0,400.0,,,,
239,Cybersecurity: Threats and Countermeasures,"An in-depth exploration of cybersecurity threats, countermeasures, and best practices, designed for IT professionals and students alike.","['cybersecurity', 'information security', 'threat analysis']",2019-11-30,978-0-98-765432-1,SecurePress,Xander Smith,1985.0,280.0,,,,
240,The Art of Coding: A Comprehensive Guide,This book covers the fundementals of programming and software development.,"['programming', 'software development', 'coding']",2020-08-15,978-3-16-148410-0,TechWise Publications,Xander Smith,1985.0,,,,,
241,Data Science Fundementals,An introductory book on data science principles and techniques.,"['data science', 'machine learning', 'big data']",2016-03-12,978-0-99-732501-2,DataWorks Ltd.,Xander Smith,1985.0,,,,,
242,Netwroking Fundametnals,"An in-depth look at networking fundamentals, including TCP/IP, routing, switching, and network security.","['networking', 'TCP/IP', 'routing', 'switching', 'network security']",2019-08-20,978-1-25-416789-4,,Xander Smith,1985.0,,,,,
243,Cleam Code,"A book on writing maintainable code in Java, C++, and other programming languages.","['clean code', 'software development', 'programming practices']",2008-08-11,978-0-13-235088-4,,Xander Smith,1985.0,,,,,
244,The Art of Coding: A Comprehensive Guide to Programming,"This book covers a wide range of programming languages including Python, Java and C++. It also delves into algorithm design and data structures.","['programming', 'Python', 'Java', 'C++', 'algorithm design', 'data structures']",2020-05-15,978-3-16-148410-0,TechBooks Co.,Xavier LeClerc,1978.0,,,,,
245,Cybersecurity Essentials: A Practical Approach to IT Security,"A practical guide to cybersecurity fundamentals, covering topics such as network security, cryptography, and risk management.","['cybersecurity', 'network security', 'cryptography', 'risk management']",2018-11-20,978-1-23-456789-0,SecurePress,Xavier LeClerc,1978.0,,,,,
246,Data Science Foundations: From Theory to Practice,"This book provides a comprehensive overview of data science concepts, tools, and techniques, with real-world examples and case studies.","['data science', 'machine learning', 'big data', 'analytics']",2019-08-10,978-0-00-000001-0,DataWorks Publishing,Xavier LeClerc,1978.0,,,,,
247,The Art of Coding: A Comprehensive Guide,"This book covers a wide range of programming languages and concepts, including Python, Java, and web development.","['coding', 'programming', 'Python', 'Java', 'web development']",2022-08-15,978-1-2345-6789-0,TechPub Inc.,Xavier LeClerc,1978.0,,,,,
248,The Art of Programming,A comprehensive guide to software development and coding practices for beginners.,"['programming', 'software development', 'coding']",2020-06-15,978-1-2345-6789-0,TechPub Inc.,Xavier Smith,1985.0,,,,,
249,Networking Essentials,An introduction to networking concepts and technologies for IT students.,"['networking', 'IT infrastructure', 'data transmission']",2018-03-20,978-0-5432-1897-3,NetCom Press,Xavier Smith,1985.0,,,,,
250,Cybersecurity Fundamentals,Exploring the basics of cybersecurity and its importance in modern organizations.,"['cybersecurity', 'information security', 'risk management']",2019-11-10,978-6-7890-1234-5,SecureBooks Ltd.,Xavier Smith,1985.0,,,,,
251,Data Science Fundementals,A deep dive into the core concepts of data science and analytics.,"['data', 'science', 'analytics']",2019-11-10,978-3-2109-8765-4,,Xavier Smith,1985.0,420.0,,,,
252,Networking Essentials,A practical approach to understanding networking principles for beginners.,"['networking', 'IT essentials', 'communication']",2016-03-12,978-0-2468101-1-2,NetCom Education,Xavier Smith,1985.0,,,,,
253,The Art of Computer Programming,A comprehensive guide to computer algorithms and data structures.,"['algorithms', 'data structures', 'programming']",2001-09-10,9780201896831,Addison-Wesley Professional,Xaiver Smith,1978.0,,,,,
254,Learning Python,An introductory book for learning the Python programming language.,"['Python', 'programming', 'beginner']",2015-06-23,9781449355739,,Xaiver Smith,1978.0,164.0,,,,
255,Computer Networking: A Top-Down Approach,"Explores the principles, technologies, and protocols used in networking.","['networking', 'protocols', 'communication']",2012-08-24,9780133072624,,Xaiver Smith,1978.0,,,,,6th
256,The Art of Programming,A comprehensive guide to software development and programming languages.,"['software', 'development', 'programming']",2015-08-21,978-1-56619-909-4,TechBooks Inc.,Xander Smith,1980.0,,,,,
257,Cybersecurity Essentials,An introduction to cybersecurity concepts and best practices for IT professionals.,"['cybersecurity', 'IT', 'networks']",2020-04-15,978-1-119-64368-2,SecurePress,Xander Smith,1980.0,,,,,
258,Data Science Fundamentals,A beginner's guide to data analysis and machine learning techniques in Python.,"['data science', 'Python', 'machine learning']",2018-11-30,978-1-4919-6107-6,DataWorks Publishing,Xander Smith,1980.0,,,,,
259,The Art of Coding: A Comprehensive Guide,This book covers the fundamentals of programming and software development.,"['programming', 'software development']",2020-07-15,978-1-2345-6789-0,TechBooks Inc.,Dr. Alisha Jonson,,,,,,
260,Cybersecurity Essentials for IT Students,A practical approach to understanding cybersecurity for IT students.,"['cybersecurity', 'IT students']",2018-05-20,978-0-5432-1987-6,SecurePress,Dr. Alisha Jonson,,,,,,
261,Data Science Foundations: From Theory to Practice,An in-depth exploration of data science principles and their applications in education.,"['data science', 'education applications']",2019-11-10,978-3-2109-8765-4,DataWorks Publishing,Dr. Alisha Jonson,,,,,,
262,The Art of Programing,A comphrehensive guide to software development and algorithm design.,"['software developement', 'algorithm design', 'programming']",2015-08-21,978-0-1234567-0-3,TechPub Inc.,Dr. Alisha Jonson,,,,,,
263,The Art of Programming,A comprehensive guide to software development and algorithm design.,"['programming', 'algorithms', 'software development']",2020-05-15,978-1-234567-89-0,TechBooks Inc.,Xavier O'Sullivan,1985.0,,,,,
264,Cybersecurity Essentials,An introduction to the fundamentals of cybersecurity for IT professionals.,"['cybersecurity', 'network security', 'information security']",2018-10-20,978-0-987654-32-1,SecurePress,Xavier O'Sullivan,1985.0,,,,,
265,Data Science Fundamentals,Exploring the principles and techniques of data analysis and visualization.,"['data science', 'data analysis', 'visualization']",2019-04-12,978-6-543210-98-7,DataWorks Publishing,Xavier O'Sullivan,1985.0,,,,,
266,The Art of Progamming,A comprehensive guide to modern programming practices and methodologies.,"['progrmming', 'methodolgies', 'software development']",2022-05-15,978-3-16-148410-0,TechBooks Inc.,Xavier O'Sullivan,1985.0,,,,,
267,The Art of Computer Science,A comprehensive guide to the principles and practices of computer science education.,"['computer science', 'education', 'programming']",2012-08-15,978-0-13-359414-0,TechBooks Inc.,Johann Smitt,1975.0,,,,,
268,Cybersecurity Fundamentals,An introductory book on cybersecurity for IT students.,"['cybersecurity', 'fundamentals', 'IT']",2017-05-20,978-1-119-28061-3,SecurePress,Johann Smitt,1975.0,,,,,
269,Data Structures and Algorithms in Python,A hands-on approach to learning data structures and algorithms using Python programming language.,"['data structures', 'algorithms', 'Python', 'programming']",2019-11-10,978-1-59327-576-6,PyBook House,Johann Smitt,1975.0,,,,,
270,The Art of Computer Sceince,A comprehensive guide to computer sceince principles and practices.,"['computer', 'sceince', 'programming']",2015-10-20,978-0-13-407642-3,,Jennifir Smith,1982.0,,,,4.7,
271,Netwroking Fundementals,Exploring the fundementals of netwroking in Information Technology education.,"['netwroking', 'fundementals', 'education']",2018-06-15,978-1-119-50485-7,,Jennifir Smith,1982.0,,,,4.5,
272,Cybersecurity Essentials,Essential concepts of cybersecurity for IT students.,"['cybersecurity', 'essentials', 'IT']",2020-03-25,978-1-119-50485-7,,Jennifir Smith,1982.0,,,,4.9,
273,The Art of Progamming,A comprehensive guide to modern programming practices and methodologies.,"['progrmming', 'methodolgies', 'software development']",2022-05-15,978-3-16-148410-0,TechBooks Inc.,Jennifir Smith,1982.0,,,,,
274,The Art of Computer Science,A comprehensive guide to computer science principles and practices.,"['computer', 'science', 'programming']",2012-05-15,978-0-13-407643-4,Pearson Education,Jennifir Smith,1985.0,,,,,
275,Cybersecurity Fundamentals,An introductory book on cybersecurity for IT students.,"['cybersecurity', 'networks', 'security']",2016-09-20,978-1-119-28070-3,,Jennifir Smith,1985.0,320.0,,,,
276,Data Analytics Essentials,A practical approach to understanding data analytics in IT education.,"['data', 'analytics', 'statistics']",2018-03-10,978-1-119-28069-7,,Jennifir Smith,1985.0,,,paperback,,
277,Data Structures Demystified,"A practical approach to understanding and implementing data structures in programming languages, with real-world examples and exercises.","['data structures', 'programming', 'algorithms', 'implementation']",2019-11-10,978-6-543210-98-7,DataWise Books,Jennifir Smith,1985.0,,,,,
278,The Art of Computer Science,A comprehensive guide to computer science principles and practices.,"['computer', 'science', 'programming']",2022-07-15,978-1-2345-6789-0,Tech Publishing Co.,Johann Doe,1985.0,,,,,
279,Cybersecurity Fundamentals,An introductory book on cybersecurity for beginners in IT education.,"['cybersecurity', 'networks', 'security']",2020-03-25,978-0-9876-5432-1,Secure Books Ltd,Johann Doe,1985.0,,,,,
280,Data Structures and Algorithms Simplified,A practical approach to understanding data structures and algorithms for IT students.,"['data', 'algorithms', 'coding']",2018-11-10,978-6-7890-1234-5,Code Masters Press,Johann Doe,1985.0,,,,,
281,Networking Essentials,A practical approach to understanding networking principles for beginners.,"['networking', 'IT essentials', 'communication']",2016-03-12,978-0-2468101-1-2,NetCom Education,Johann Doe,1985.0,,,,,
282,The Art of Computer Science,A comprehensive guide to computer science principles and practices.,"['computer science', 'programming', 'algorithms']",2017-05-15,978-1-234567-89-0,TechBooks Inc.,Johann Doe,1985.0,,,,,
283,Network Security Fundamentals,An essential resource for understanding the principles of network security and implementing best practices.,"['network', 'security', 'fundamentals', 'best practices']",2018-11-25,978-6-7890-1234-5,SecureNet Books,Johann Doe,1985.0,,,,,
284,The Art of Programing,A comphrehensive guide to software development and algorithm design.,"['software developement', 'algorithm design', 'programming']",2015-08-21,978-0-1234567-0-3,TechPub Inc.,Johann Smitt,1978.0,,,,,
285,Cybersecurity Fundametals,An introduction to cybersecurity principles and practices for beginners.,"['cybersecurity', 'network security', 'information security']",2019-05-12,978-1-234567-89-0,SecureReads,Johann Smitt,1978.0,,,,,
286,Data Science Essentials,A practical approach to learning data science for IT professionals.,"['data science', 'machine learning', 'big data']",2020-11-30,978-6-789012-34-5,DataMinds,Johann Smitt,1978.0,,,,,
287,The Art of Computer Science,A comprehensive guide to computer science principles and practices.,"['computer science', 'programming', 'algorithms']",2017-05-15,978-1-234567-89-0,TechBooks Inc.,Xander Smith,1985.0,,,,,
288,Cybersecurity Fundamentals,An introduction to cybersecurity for beginners in IT education.,"['cybersecurity', 'network security', 'information security']",2020-10-20,978-0-987654-32-1,SecurePress,Xander Smith,1985.0,,,,,
289,Data Analytics Essentials,A practical handbook for understanding and applying data analytics in educational settings.,"['data analytics', 'big data', 'data visualization']",2019-03-10,978-6-543210-98-7,DataMinds Co.,Xander Smith,1985.0,,,,,
290,The Art of Programming,A comprehensive guide to mastering programming languages and algorithms for aspiring IT professionals.,"['programming', 'algorithms', 'education']",2022-05-15,978-1-23456-789-0,,Dr. Alysia Jonson,1975.0,,,hardcover,,
291,Cybersecurity Essentials,An essential primer on cybersecurity principles and best practices for students and professionals in the field.,"['cybersecurity', 'network security', 'education']",2019-10-20,978-0-98765-432-1,,Dr. Alysia Jonson,1975.0,,,ebook,,
292,Data Science Fundamentals,A foundational textbook providing a hands-on introduction to data science concepts and tools.,"['data science', 'analytics', 'education']",2020-08-30,978-6-54321-098-7,,Dr. Alysia Jonson,1975.0,,,paperback,,
293,Cleam Code,"A book on writing maintainable code in Java, C++, and other programming languages.","['clean code', 'software development', 'programming practices']",2008-08-11,978-0-13-235088-4,,Dr. Alysia Jonson,1975.0,,,,,
294,Cybersecurity Fundamentls for Students,"A practical approach to teaching cybersecurity concepts to IT students, with hands-on exercises and case studies.","['cybersecurity', 'IT education', 'network security']",2019-10-20,978-1-25-648301-2,SecureEd Publishing,Dr. Alysia Jonson,1975.0,,,,,
295,The Art of Coding: A Comprehensive Guide,"This book covers the fundementals of programing and software development, including object-oriented design principles and data structures.","['programing', 'software development', 'object-oreinted design', 'data strutcures']",2012-06-15,978-0-13-449416-6,TechPub Inc.,Dr. Alysia Jonson,1975.0,,,,,
296,The Art of Proggramming,A comprehensive guide to mastering programming languages and best practices.,"['programming', 'coding', 'software development']",2012-05-15,978-0-1234567-0-3,TechBooks Inc.,Xander Z. Smith,1975.0,,,,,
297,Cybersecurity Essentials,An essential introduction to cybersecurity concepts and practices for IT students.,"['cybersecurity', 'network security', 'information security']",2015-09-20,978-0-7654321-0-9,SecurePress,Xander Z. Smith,1975.0,,,,,
298,Data Science Fundementals,A beginner's guide to data science principles and techniques in educational settings.,"['data science', 'big data', 'analytics']",2018-03-10,978-0-9876543-0-5,DataMinds Publishing,Xander Z. Smith,1975.0,,,,,
299,Network Security Fundamentals,An essential resource for understanding the principles of network security and implementing best practices.,"['network', 'security', 'fundamentals', 'best practices']",2018-11-25,978-6-7890-1234-5,SecureNet Books,Xander Z. Smith,1975.0,,,,,
300,Data Science Fundementals,An introductory book on data science principles and techniques.,"['data science', 'machine learning', 'big data']",2016-03-12,978-0-99-732501-2,DataWorks Ltd.,Xander Z. Smith,1975.0,,,,,
301,The Art of Computer Science Education,A comprehensive guide to teaching computer science concepts in a fun and engaging way.,"['computer', 'science', 'education']",2020-08-15,978-1-234567-89-0,,Xander Z. Smith,1975.0,,,ebook,,
302,The Art of Proggramming,A comprehensive guide to software development and coding practices.,"['programming', 'software development', 'coding']",2022-05-15,978-3-16-148410-0,TechPub Inc.,Dr. Alica Murtin,1978.0,,,,,
303,Netwroking Essentials,An introductory book on computer networking and security principles.,"['networking', 'security', 'computer science']",2019-10-20,978-1-25-846372-4,ITBooks Co.,Dr. Alica Murtin,1978.0,,,,,
304,Data Analytics in Education,Exploring the use of data analytics in educational institutions for decision-making.,"['data analytics', 'education', 'decision-making']",2020-08-30,978-0-18-635240-5,EduTech Press,Dr. Alica Murtin,1978.0,,,,,
305,Cybersecurity Essentials,Essential concepts of cybersecurity for IT students and professionals.,"['cybersecurity', 'essentials', 'education']",2017-11-30,978-1-58713-345-1,,Dr. Alica Murtin,1978.0,,,,,
306,The Art of Computer Science Education,A comprehensive guide to teaching computer science concepts in a fun and engaging way.,"['computer', 'science', 'education']",2020-08-15,978-1-234567-89-0,,Dr. Alica Murtin,1978.0,,,ebook,,
307,The Art of Proggramming,A comprehensive guide to mastering programming languages and software development techniques.,"['programming', 'software development', 'coding']",2012-08-15,978-0-321-68056-3,TechPub Inc.,Xavieer Smiith,1975.0,,,,,
308,Netwrok Security Essentials,An in-depth exploration of network security principles and best practices for IT professionals.,"['network security', 'cybersecurity', 'IT infrastructure']",2008-05-20,0-13-610804-9,SecurePress,Xavieer Smiith,1975.0,,,,,
309,Data Science Fundamentalls,A beginner's guide to understanding data science concepts and methodologies for educational purposes.,"['data science', 'analytics', 'big data']",2015-11-10,978-0-262-52981-4,DataWorks Publishing,Xavieer Smiith,1975.0,,,,,
310,The Art of Computer Science,A comprehensive guide to computer science principles and applications.,"['computer science', 'programming', 'algorithms']",2020-08-15,978-1-234567-89-0,,Xavieer Smiith,1975.0,,,hardcover,,
311,Data Analytics Essentials,A practical approach to understanding data analytics in IT education.,"['data', 'analytics', 'statistics']",2018-03-10,978-1-119-28069-7,,Xavieer Smiith,1975.0,,,paperback,,
312,Netwokrs and Data Security,"Exploring the principles of network security, data protection, and cyber defense strategies.","['networks', 'data security', 'cyber defense']",2020-11-30,978-1-119-59250-6,SecurePress,Xavieer Smiith,1975.0,,,,,
313,The Fundamentels of Coding,A comprehensive guide to learning the basics of programming and software development.,"['coding', 'programming', 'software development']",2020-05-15,978-1-234567-89-0,TechMaster Publishing,Xander McTechie,1985.0,,,,,
314,Cybersecurity Essentials,An essential book for understanding cybersecurity principles and practices in modern IT environments.,"['cybersecurity', 'IT security', 'network protection']",2018-11-30,978-0-987654-32-1,SecureTech Books,Xander McTechie,1985.0,,,,,
315,Data Science Foundations,"A foundtional text for anyone interested in data science and analytics, covering key concepts and techniques.","['data science', 'analytics', 'statistics']",2019-08-20,978-6-543210-98-7,DataWorks Press,Xander McTechie,1985.0,,,,,
316,Data Science Essentials,"An introductory book on data science, covering statistical analysis and machine learning algorithms.","['data science', 'machine learning', 'statistics']",2018-11-30,978-0-987654-32-1,DataWorks Publishing,Xander McTechie,1985.0,,,,,
