,title,description,tags,release_date,ISBN_number,publisher,author_name,author_birth_year,pages,related_courses,format,rating,edition
114,The Art of Progamming,A comprehensive guide to modern programming practices and methodologies.,"['progrmming', 'methodolgies', 'software development']",2022-05-15,978-3-16-148410-0,TechBooks Inc.,Xavier van der Berg,1978.0,,,,,
115,Cybersecurity Essentials,An introductory book covering the essentials of cybersecurity for beginners.,"['cybersecurity', 'network security', 'data protection']",2019-10-28,978-1-25-678902-4,InfoSec Publications,Xavier van der Berg,1978.0,,,,,
116,Data Science Fundamentals,A practical approach to understanding data science concepts and applications in IT education.,"['data science', 'analytics', 'machine learning']",2017-06-12,978-5-33-901267-6,BigData Press,Xavier van der Berg,1978.0,,,,,
117,The Fundamentls of Computer Science,"This book covers the basics of computer science including algorithms, data structures, and programming languages.","['computer science', 'algorithms', 'programming languages']",2020-08-15,978-1-2345-6789-0,TechPub,Jennifir Smith,,,,,,
118,Netwroking Essentials,A comprehensive guide to networking essentials for IT students and professionals.,"['networking', 'IT essentials', 'data communication']",2018-05-20,978-0-5432-1987-6,InfoBooks Inc.,Jennifir Smith,,,,,,
119,The Art of Computer Science,A compreensive guide to computer science principles and practices.,"['computer', 'science', 'guide']",2015-08-20,978-0-13-359414-0,,Jennifir Smith,,,"['Algorithms', 'Data Structures']",,,
120,Networking Essentials for Students,"A practical approach to understanding networking concepts and protocols, with hands-on exercises for students.","['networking', 'protocols', 'hands-on']",2018-05-20,978-1-23-456789-0,EduTech Publications,Jennifir Smith,,,,,,
121,The Art of Computer Science,A comprehensive guide to computer science principles and practices.,"['computer science', 'algorithms', 'programming']",2020-05-15,978-3-16-148410-0,,Xavier Montogmery,1978.0,,,,,
122,Netwroking Essentials,An in-depth look at networking essentials for IT professionals.,"['networking', 'IT infrastructure', 'data transmission']",2018-10-22,978-1-25-607510-4,,Xavier Montogmery,1978.0,,,,,
123,Cybersecurity Fundementals,A beginner's guide to cybersecurity fundamentals and best practices.,"['cybersecurity', 'information security', 'risk management']",2019-04-30,978-0-78-975820-2,,Xavier Montogmery,1978.0,,,,,
124,Cybersecurity Fundementals,A beginner's guide to cybersecurity concepts and best practices.,"['cybersecurity', 'information security', 'threat detection']",2019-04-12,978-3-2109-8765-4,SecurePress,Xavier Montogmery,1978.0,240.0,,,,
125,The Art of Infrmation Technology Education,"A comprehensive guide to teaching IT concepts in the classroom, covering topics such as programming, networking, and cybersecurity.","['education', 'IT', 'teaching', 'classroom']",2015-08-20,978-1-2345-6789-0,TechEd Publishing,Lysa Ganger,1982.0,,,,,
126,Coding for Beginners: A Practical Approach,"This book offers a hands-on approach to learning coding, suitable for beginners and educators alike.","['coding', 'beginners', 'hands-on', 'educators']",2020-03-10,978-0-5432-1987-6,CodeMasters Press,Lysa Ganger,1982.0,,,,,
127,Network Security Fundamentals,An essential resource for understanding the principles of network security and implementing best practices.,"['network', 'security', 'fundamentals', 'best practices']",2018-11-25,978-6-7890-1234-5,SecureNet Books,Lysa Ganger,1982.0,,,,,
128,Cybersecurity Essentials: A Practical Approach to IT Security,"A practical guide to cybersecurity fundamentals, covering topics such as network security, cryptography, and risk management.","['cybersecurity', 'network security', 'cryptography', 'risk management']",2018-11-20,978-1-23-456789-0,SecurePress,Lysa Ganger,1982.0,,,,,
129,The Art of Coding: A Comprehensive Guide,"This book covers a wide range of programming languages and their applications in educational settings, from Python to Java.","['programming', 'education', 'languages']",2020-07-15,978-3-16-148410-0,TechEd Press,Xavier Smith,,,,,,
130,Networking Essentials for Students,"A practical approach to understanding networking concepts and protocols, with hands-on exercises for students.","['networking', 'protocols', 'hands-on']",2018-05-20,978-1-23-456789-0,EduTech Publications,Xavier Smith,,,,,,
131,Cybersecurity Fundamentals: A Beginner's Guide,"An introductory book on cybersecurity, covering basic principles and best practices for IT students.","['cybersecurity', 'beginner', 'IT']",2019-11-10,978-0-08-765432-1,InfoSec Books,Xavier Smith,,,,,,
132,Netwroking Fundametnals,"An in-depth look at networking fundamentals, including TCP/IP, routing, switching, and network security.","['networking', 'TCP/IP', 'routing', 'switching', 'network security']",2019-08-20,978-1-25-416789-4,,Xavier Smith,,,,,,
133,The Art of Proggramming,A comprehensive guide to mastering programming languages and algorithms.,"['programming', 'algorithms', 'education']",2020-05-15,978-1-56619-909-4,TechEdu Publications,Xavier Smith,,,,,,
134,Netwokrs and Data Security,"Exploring the principles of network security, data protection, and cyber defense strategies.","['networks', 'data security', 'cyber defense']",2020-11-30,978-1-119-59250-6,SecurePress,Xavier Smith,,,,,,
135,The Art of Coding,A comprehensive guide to programming languages and algorithms.,"['programming', 'algorithms', 'coding']",2020-07-15,978-1-2345-6789-0,TechBooks Inc.,Xavier LeClerc,,,,,,
136,Cybersecurity Essentials,An introduction to the fundamentals of cybersecurity for IT professionals.,"['cybersecurity', 'network security', 'IT fundamentals']",2018-05-20,978-0-9876-5432-1,InfoSec Publications,Xavier LeClerc,,,,,,
137,Data Science Foundations,"Exploring the intersection of statistics, machine learning, and data analysis in IT education.","['data science', 'statistics', 'machine learning']",2019-11-10,978-6-7890-1234-5,DataWorks Co.,Xavier LeClerc,,,,,,
138,The Art of Computer Science Education,A comprehensive guide to teaching computer science concepts in a fun and engaging way.,"['computer', 'science', 'education']",2020-08-15,978-1-234567-89-0,,Xavier LeClerc,,,,ebook,,
139,Data Structures Demystified,"A practical approach to understanding and implementing data structures in programming languages, with real-world examples and exercises.","['data structures', 'programming', 'algorithms', 'implementation']",2019-11-10,978-6-543210-98-7,DataWise Books,Xavier LeClerc,,,,,,
140,Cybersecurity Essentials for Teachers,This book provides an overview of cybersecurity principles and best practices tailored for educators and IT professionals.,"['cybersecurity', 'education', 'network security']",2017-04-10,978-6-7890-1234-5,SecureIT Books,Xavier LeClerc,,,,,,
141,The Art of Computer Programming,A comprehensive guide to algorithms and data structures.,"['algorithms', 'data structures', 'programming']",1973-01-10,9780201896831,Addison-Wesley Professional,Randal E. Brt,1960.0,,,,,
142,Netwokr Security Essentials,An introduction to network security principles and practices.,"['network security', 'cybersecurity', 'encryption']",2009-08-11,9780136108054,Pearson Education,Randal E. Brt,1960.0,,,,,
143,Databse Systems: The Complete Book,A comprehensive overview of database management systems.,"['database management', 'SQL', 'relational databases']",2002-09-17,9780131873254,Pearson Education,Randal E. Brt,1960.0,,,,,
144,The Fundamentels of Coding,A comprehensive guide to learning the basics of programming and software development.,"['coding', 'programming', 'software development']",2020-05-15,978-1-234567-89-0,TechMaster Publishing,Randal E. Brt,1960.0,,,,,
145,Network Infrastructure Planning and Deployment,A practical handbook for designing and implementing network infrastructure in educational institutions.,"['network', 'infrastructure', 'planning', 'deployment', 'educational institutions']",2019-11-10,978-1-119-59283-7,Netw0rkBooks,Randal E. Brt,1960.0,,,,,
146,Data Science in Education: Bridging Theory and Practice,"Examines the application of data science techniques in educational settings, offering insights for IT educators.","['data science', 'education', 'IT educators']",2019-04-12,978-0-5555-4321-0,Academic Publishing Co.,Randal E. Brt,1960.0,,,,,
147,The Art of Coding: A Comprehensive Guide,"This book cover's a wide range of topics related to programming and software development, including algorithms, data structures, and best practices in software engineering.","['programming', 'software development', 'algorithms', 'data structures']",2020-06-15,978-3-16-148410-0,TechPublish Co.,Randal E. Brt,1960.0,,,,,
148,The Art of Computer Science,A comprehensive guide to computer science principles and practices.,"['computer science', 'programming', 'algorithms']",2020-05-15,978-1-2345-6789-0,TechPub,Xavieer Smiith,,350.0,,,,
149,Netwroking Essentials,An introductory book on networking essentials for IT students.,"['networking', 'IT infrastructure', 'protocols']",2018-10-20,978-0-5432-1987-6,InfoBooks,Xavieer Smiith,,280.0,,,,
150,Cybersecurity Fundementals,A beginner's guide to cybersecurity concepts and best practices.,"['cybersecurity', 'information security', 'threat detection']",2019-04-12,978-3-2109-8765-4,SecurePress,Xavieer Smiith,,240.0,,,,
151,The Art of Computer Science,A comprehensive guide to computer science fundamentals and programming principles.,"['computer science', 'programming', 'algorithms']",2022-05-15,978-1-2345-6789-0,TechPub Inc.,Xavieer Smiith,,,,,,
152,The Art of Computer Science,"A comphrensive guide to computer science education, covering topics such as algorithms, data structures and programming languages.","['computer science', 'algorithms', 'programming languages']",2015-07-21,978-0-13-449416-6,Pearson Education,Johh Smith,1980.0,,,,,
153,Network Security Fundementals,An in-depth look at network security principles and practices for IT professionals and students.,"['network security', 'IT professionals', 'security principles']",2018-04-12,978-1-305-25333-9,Cengage Learning,Johh Smith,1980.0,,,,,
154,Web Development Essentials,"A practical guide to web development, including HTML, CSS, JavaScript, and responsive design techniques.","['web development', 'HTML', 'CSS', 'JavaScript', 'responsive design']",2017-09-30,978-1-119-37777-3,Wiley,Johh Smith,1980.0,,,,,
155,The Art of Proggramming,A comprehensive guide to mastering programming languages and algorithms.,"['proggramming', 'algorithms', 'coding']",2020-05-15,978-3-16-148410-0,TechMasters Press,Johann Smitz,1978.0,,,,,
156,Cybersecurity Essentials,Essential concepts and strategies for cybersecurity in modern IT environments.,"['cybersecurity', 'network security', 'data protection']",2018-10-20,978-1-25-846302-9,SecureIT Publishing,Johann Smitz,1978.0,,,,,
157,Data Science Fundementals,An introductory book on data science principles and techniques.,"['data science', 'machine learning', 'big data']",2016-03-12,978-0-99-732501-2,DataWorks Ltd.,Johann Smitz,1978.0,,,,,
158,The Art of Coding: A Comprehensive Guide,This book covers the fundementals of programming and software development.,"['programming', 'software development', 'coding']",2020-08-15,978-3-16-148410-0,TechWise Publications,Johann Smitz,1978.0,,,,,
159,Data Structures Demystified,"A practical approach to understanding and implementing data structures in programming languages, with real-world examples and exercises.","['data structures', 'programming', 'algorithms', 'implementation']",2019-11-10,978-6-543210-98-7,DataWise Books,Johann Smitz,1978.0,,,,,
160,Cybersecurity Essentials,An essential primer on cybersecurity principles and best practices for students and professionals in the field.,"['cybersecurity', 'network security', 'education']",2019-10-20,978-0-98765-432-1,,Johann Smitz,1978.0,,,ebook,,
161,C0ding for Beginn3rs,"A comprehensive guide to learning programming languages from scratch, including Python, Java, and C++.","['programming', 'Python', 'Java', 'C++']",2022-06-15,978-1-2345-6789-0,TechPub Inc.,Dr. Alice Mayer,1975.0,,,,,
162,Cyb3rsecurity Essentials,"An introductory book on cybersecurity principles, covering topics such as network security, encryption, and threat detection.","['cybersecurity', 'network security', 'encryption', 'threat detection']",2019-11-30,978-0-5432-1987-6,SecureBooks Co.,Dr. Alice Mayer,1975.0,,,,,
163,Data Science Fundament@ls,"Exploring the basics of data science, including statistical analysis, machine learning, and data visualization techniques.","['data science', 'statistical analysis', 'machine learning', 'data visualization']",2020-08-20,978-6-7890-1234-5,DataWorks Ltd.,Dr. Alice Mayer,1975.0,,,,,
164,The Art of Computer Scence,A comprehensive guide to computer science concepts and theories.,"['computer', 'scence', 'education']",2015-10-20,978-0-1234567-8-9,TechPub,Xavier Smith,1980.0,350.0,,,,
165,Cybersecurity Fundamntals,An introduction to cybersecurity principles and best practices for beginners.,"['cybersecurity', 'fundamntals', 'beginners']",2020-05-15,978-0-9876543-2-1,Securitech,Xavier Smith,1980.0,220.0,,,,
166,Data Analytics: A Practical Approach,Practical insights into data analytics with real-world examples and case studies.,"['data', 'analytics', 'practical', 'case', 'studies']",2018-02-28,978-0-2468101-2-3,AnalytixPress,Xavier Smith,1980.0,280.0,,,,
167,Cloud Computing Essentials,A practical approach to understanding cloud computing for IT education purposes.,"['cloud', 'computing', 'essentials', 'IT', 'education']",2019-08-10,978-5-55-555555-5,CloudPub,Xavier Smith,1980.0,,,,,
168,Networking Essentials: A Comprehensive Approach,"A comprehensive guide to networking essentials, suitable for both beginners and advanced learners in IT education.","['networking', 'data transmission', 'IT infrastructure']",2018-05-20,978-1-25-683902-4,Connectivity Press,Xavier Smith,1980.0,,,,,
169,Databas3 Management Essentals,"A practical handbook for understanding and implementing database management systems, tailored for IT education programs and self-study.","['database', 'management', 'systems', 'IT', 'education']",2018-04-25,978-6-7890-1234-5,DataWise Books,Xavier Smith,1980.0,,,,,
170,The Art of Coding: A Comprehensive Guide,"This book covers a wide range of programming languages and concepts, including Python, Java, and web development.","['coding', 'programming', 'Python', 'Java', 'web development']",2022-08-15,978-1-2345-6789-0,TechPub Inc.,Xavier Smith,,,,,,
171,Network Security Fundamentals,An in-depth exploration of network security principles and best practices for IT professionals and students.,"['network security', 'IT professionals', 'best practices']",2019-05-20,978-0-5432-1987-6,CyberSafe Books,Xavier Smith,,,,,,
172,Netw0rk Security Fundament@ls,"An essential book covering the basics of network security, including firewalls, encryption, and intrusion detection systems.","['network security', 'firewalls', 'encryption', 'intrusion detection']",2018-10-20,978-0-5432-1897-6,CyberSafe Publishing,Xavier Smith,,,,,,
173,Network Infrastructure Planning and Deployment,A practical handbook for designing and implementing network infrastructure in educational institutions.,"['network', 'infrastructure', 'planning', 'deployment', 'educational institutions']",2019-11-10,978-1-119-59283-7,Netw0rkBooks,Xavier Smith,,,,,,
174,Netwokr Security Essentials,An introduction to network security principles and practices.,"['network security', 'cybersecurity', 'encryption']",2009-08-11,9780136108054,Pearson Education,Xavier Smith,,,,,,
175,The Art of Coding: A Comprehensive Guide,"This book explores the fundamental concepts and best practices in software development, covering topics such as algorithms, data structures, and design patterns.","['software development', 'algorithms', 'data structures', 'design patterns']",2022-05-15,978-1-2345-6789-0,TechPublishing Co.,Xavier LeClerc,1978.0,,,,,
176,Cybersecurity Essentials for Beginners,"A beginner's guide to understanding cybersecurity principles and techniques, with a focus on practical applications in educational settings.","['cybersecurity', 'beginners', 'education']",2021-10-20,978-0-5432-1987-6,SecurePress,Xavier LeClerc,1978.0,,,,,
177,Networking Fundamentals: From Basics to Beyond,"An in-depth exploration of networking fundamentals, including protocols, hardware, and emerging technologies, suitable for students and professionals alike.","['networking', 'fundamentals', 'protocols', 'hardware', 'emerging technologies']",2019-03-12,978-3-2109-8765-4,Connectivity Books,Xavier LeClerc,1978.0,,,,,
178,The Art of Coding,A comprehensive guide to programming and software development.,"['programming', 'software development', 'education']",2020-08-15,978-1-2345-6789-0,TechBooks Inc.,Xavier LeClerc,1978.0,,,,,
179,Data Analytics Essentials,A practical approach to understanding data analytics in IT education.,"['data', 'analytics', 'statistics']",2018-03-10,978-1-119-28069-7,,Xavier LeClerc,1978.0,,,paperback,,
180,Data Science Fundementals,A deep dive into the core concepts of data science and analytics.,"['data', 'science', 'analytics']",2019-11-10,978-3-2109-8765-4,,Xavier LeClerc,1978.0,420.0,,,,
181,The Art of Computer Science Education,"A comprehensive guide to teaching computer science concepts in a fun and engaging way, suitable for educators and students alike.","['computer science', 'education', 'teaching', 'curriculum']",2020-06-15,978-1-234567-89-0,TechEd Press,Kathleen Susskain,1978.0,,,,,
182,Coding Fundamentals for Beginners,"An introductory book covering the basics of coding, algorithms, and problem-solving techniques for beginners in IT education.","['coding', 'algorithms', 'problem solving', 'beginners']",2018-03-20,978-0-987654-32-1,CodeMasters Publishing,Kathleen Susskain,1978.0,,,,,
183,Data Structures Demystified,"A practical approach to understanding and implementing data structures in programming languages, with real-world examples and exercises.","['data structures', 'programming', 'algorithms', 'implementation']",2019-11-10,978-6-543210-98-7,DataWise Books,Kathleen Susskain,1978.0,,,,,
184,Cybersecurity Essentials,An essential book for understanding the basics of cybersecurity in educational settings.,"['cybersecurity', 'basics', 'educational']",2018-12-20,978-1-25-618302-4,InfoTech Books,Kathleen Susskain,1978.0,,,,,
185,Networking Essentials for Students,"A practical approach to understanding networking concepts and protocols, with hands-on exercises for students.","['networking', 'protocols', 'hands-on']",2018-05-20,978-1-23-456789-0,EduTech Publications,Kathleen Susskain,1978.0,,,,,
186,Cybersecurity Fundamentals for Teachers,A practical guide for educators to understand the basics of cybersecurity and implement best practices in the classroom environment.,"['cybersecurity', 'teachers', 'network security', 'best practices']",2017-08-20,978-6-543210-98-7,SecureEd Press,Kathleen Susskain,1978.0,,,,,
187,The Art of Coding: A Comprehensive Guide,"This book cover's a wide range of topics related to programming and software development, including algorithms, data structures, and best practices in software engineering.","['programming', 'software development', 'algorithms', 'data structures']",2020-06-15,978-3-16-148410-0,TechPublish Co.,Xander McTechie,1978.0,,,,,
188,Cybersecurity Fundamentals for Beginners,"A beginner-friendly introduction to the world of cybersecurity, covering topics such as network security, encryption, and threat detection.","['cybersecurity', 'network security', 'encryption', 'threat detection']",2018-11-30,978-1-25-846702-4,SecureBooks Inc.,Xander McTechie,1978.0,,,,,
189,The Art of Progrmming,A comprehensive guide to lerning programming languages and software development practices.,"['progrmming', 'software development', 'lerning']",2020-05-15,978-3-16-148410-0,,Xander McTechie,1978.0,,,ebook,,
190,Cybersecurity Fundamentals,An introductory book on cybersecurity for beginners.,"['cybersecurity', 'network security', 'data protection']",2018-05-20,978-1-119-50458-2,SecurePress,Xander McTechie,1978.0,250.0,,,,
191,The Art of Computer Science,A compreensive guide to computer science education and its applications in the modern world.,"['computer', 'science', 'education']",2015-08-21,978-0-13-359414-0,,Johne Smithe,1978.0,,"['Computer Programming', 'Data Structures']",,,
192,Cybersecurity Fundamentals,An introduction to cybersecurity principles and practices for IT students.,"['cybersecurity', 'IT', 'fundamentals']",2019-03-15,978-1-119-52589-4,,Johne Smithe,1978.0,,"['Network Security', 'Ethical Hacking']",,,
193,Database Management Essentials,A practical approach to learning database management for aspiring IT professionals.,"['database', 'management', 'essentials']",2017-11-30,978-0-12-374469-3,,Johne Smithe,1978.0,,"['SQL Fundamentals', 'Database Design']",,,
194,Introduktion to Informatics,A compreensive guide to the fundamentels of informatics and computer science.,"['informatics', 'computer science', 'education']",2014-06-15,978-0-13-212271-9,,Johne Smithe,1978.0,,,,,
195,Cybersecurity Fundamentals,An introductory book on cybersecurity for beginners.,"['cybersecurity', 'network security', 'data protection']",2018-05-20,978-1-119-50458-2,SecurePress,Johne Smithe,1978.0,250.0,,,,
196,Data Analytics: A Practical Approach,Practical insights into data analytics with real-world examples and case studies.,"['data', 'analytics', 'practical', 'case', 'studies']",2018-02-28,978-0-2468101-2-3,AnalytixPress,Johne Smithe,1978.0,280.0,,,,
197,Cybersecurity Fundamentals for Teachers,A practical guide for educators to understand the basics of cybersecurity and implement best practices in the classroom environment.,"['cybersecurity', 'teachers', 'network security', 'best practices']",2017-08-20,978-6-543210-98-7,SecureEd Press,Johne Smithe,1978.0,,,,,
198,Cybersecurity Fundamentals,An introductory book on cybersecurity for beginners.,"['cybersecurity', 'network security', 'data protection']",2018-05-20,978-1-119-50458-2,SecurePress,Johne Smithe,1978.0,250.0,,,,
199,C0ding for Beginners,"A comprehensive guide to learning programming languages such as Python, Java, and C++ for beginners in IT education.","['programming', 'Python', 'Java', 'C++']",2022-05-15,978-1-2345-6789-0,TechEd Press,Dr. Alice Wunderland,1985.0,,,,,
200,Netw0rk Security Fundament@ls,"An essential book covering the basics of network security, including firewalls, encryption, and intrusion detection systems.","['network security', 'firewalls', 'encryption', 'intrusion detection']",2018-10-20,978-0-5432-1897-6,CyberSafe Publishing,Dr. Alice Wunderland,1985.0,,,,,
201,Datab@s3 Management Essentials,"A practical handbook for understanding database management systems, SQL queries, and data modeling in IT education.","['database management', 'SQL', 'data modeling']",2020-03-12,978-6-7890-1234-5,DataWise Books,Dr. Alice Wunderland,1985.0,,,,,
202,Data Science Foundations: From Theory to Practice,"An introductory text on data science, focusing on statistical analysis, machine learning, and big data technologies. Suitable for students and professionals alike.","['data science', 'statistical analysis', 'machine learning', 'big data']",2018-07-10,978-0-13-518279-2,DataWorks Co.,Dr. Alice Wunderland,1985.0,,,,,
203,Introdution to Databese Management,"A comprehensive guide to database concepts and management techniques, covering SQL, NoSQL, and data modeling.","['databese', 'managment', 'SQL', 'NoSQL', 'data model']",2020-07-15,978-0-13-340568-2,TechPubl1shers,Dr. Alice Smith,,,,,,
204,Cybersecurity Fundamntals for IT Professionals,An introductory book on cybersecurity essentials for Information Technology professionals.,"['cybersecurity', 'IT', 'professionals', 'fundamntals']",2018-05-20,978-1-119-51886-9,Secur1tyPress,Dr. Alice Smith,,,,,,
205,Network Infrastructure Planning and Deployment,A practical handbook for designing and implementing network infrastructure in educational institutions.,"['network', 'infrastructure', 'planning', 'deployment', 'educational institutions']",2019-11-10,978-1-119-59283-7,Netw0rkBooks,Dr. Alice Smith,,,,,,
206,The Art of Programming,A comprehensive guide to mastering programming languages and algorithms.,"['programming', 'algorithms', 'education']",2022-05-15,978-3-16-148410-0,,Xavier O'Sullivan,1978.0,,,,,
207,Cybersecurity Essentials,Learn the fundamental concepts of cybersecurity and its importance in IT education.,"['cybersecurity', 'IT', 'networks']",2019-10-08,978-1-25-814720-7,,Xavier O'Sullivan,1978.0,,,,,
208,Data Science Fundamentals,An introductory book to data science for students pursuing IT education.,"['data science', 'analytics', 'education']",2020-07-22,978-5-36-229801-4,,Xavier O'Sullivan,1978.0,,,,,
209,Data Analytics Essentials,Exploring the fundamentals of data analytics and its applications.,"['data analytics', 'big data', 'data visualization']",2019-03-12,978-6-7890-1234-5,DataInsights,Xavier O'Sullivan,1978.0,280.0,,,,
210,Cybersecurity Essentials: A Practical Approach to IT Security,"A practical guide to cybersecurity fundamentals, covering topics such as ntwork security, cryptography, and risk management.","['cybersecurity', 'network security', 'cryptography', 'risk management']",2018-11-20,978-1-23-456789-0,SecurePress,Xavier O'Sullivan,1978.0,,,,,
211,Cybersecurity Essentials for Teachers,This book provides an overview of cybersecurity principles and best practices tailored for educators and IT professionals.,"['cybersecurity', 'education', 'network security']",2017-04-10,978-6-7890-1234-5,SecureIT Books,Xavier O'Sullivan,1978.0,,,,,
